{
  "schemaVersion": 5,
  "readingProgress": [{
    "document": {"id": "sample-book", "fileName": "sample.epub", "fingerprint": "sha256:sample"},
    "pageIndex": 2, "updatedAt": "2026-09-09T12:00:00Z"
  }],
  "savedExplanations": [{
    "id": "11111111-1111-1111-1111-111111111111",
    "document": {"id": "sample-book", "fileName": "sample.epub"},
    "pageIndex": 2,
    "request": {"targetText": "She reads a book.", "sourceLanguage": "English", "explanationLanguage": "Chinese", "precedingContext": "It is a quiet afternoon.", "followingContext": null},
    "explanation": {
      "translation": "她在读一本书。", "sentenceCore": "She reads a book.",
      "grammarPoints": [{"title": "reads", "explanation": "一般现在时"}],
      "keyPhrases": [{"text": "a book", "meaning": "一本书", "example": "I have a book."}],
      "modelName": "fixture"
    },
    "locator": {"chapterHref": "Text/chapter1.xhtml", "textAnchor": "{\"offset\":12,\"quote\":\"She reads\",\"progress\":0.2}", "displayPageIndex": 2, "kind": "epub"},
    "createdAt": "2026-09-09T12:00:00Z", "updatedAt": "2026-09-09T20:00:00+08:00"
  }],
  "vocabularyEntries": [{
    "id": "22222222-2222-2222-2222-222222222222", "language": "Japanese", "lemma": "本", "reading": "ほん", "partOfSpeech": "noun",
    "surfaceForms": ["本"],
    "senses": [{"id": "33333333-3333-3333-3333-333333333333", "meaning": "书", "explanationLanguage": "Chinese"}],
    "sources": [{"id": "44444444-4444-4444-4444-444444444444", "document": {"id": "sample-pdf", "fileName": "sample.pdf"}, "sentence": "本を読みます。", "surface": "本", "pageIndex": 0,
      "locator": {"kind": "pdf", "pageIndex": 0, "textOffset": 3, "textHash": "sample-hash"}, "createdAt": "2026-09-09T12:00:00Z"}],
    "createdAt": "2026-09-09T12:00:00Z", "updatedAt": "2026-09-09T12:00:00Z"
  }],
  "reviewCards": [{
    "id": "55555555-5555-5555-5555-555555555555", "vocabularyEntryID": "22222222-2222-2222-2222-222222222222",
    "template": "recognition", "state": "review", "dueAt": "2026-09-11T12:00:00Z", "intervalDays": 2,
    "easeFactor": 2.5, "repetitions": 1, "lapses": 0, "lastReviewedAt": "2026-09-09T12:00:00Z",
    "createdAt": "2026-09-09T12:00:00Z", "updatedAt": "2026-09-09T12:00:00Z"
  }],
  "reviewLogs": [{
    "id": "66666666-6666-6666-6666-666666666666", "cardID": "55555555-5555-5555-5555-555555555555", "vocabularyEntryID": "22222222-2222-2222-2222-222222222222",
    "rating": "good", "reviewedAt": "2026-09-09T12:00:00Z", "previousState": "new", "previousIntervalDays": 0,
    "scheduledIntervalDays": 2, "scheduledDueAt": "2026-09-11T12:00:00Z", "schedulerVersion": "jieju-interval-v1"
  }]
}
